{
  "artifact_type": "gpt_handoff.packet.review.request",
  "artifact_version": "0.1.0",
  "packet_id": "pkt-kernel-trust-spec-001",
  "workflow_state": "DEFINITION_UNDER_REVIEW",
  "review_state": "DEFINITION_UNDER_REVIEW",
  "submitted_by": {
    "role": "chatgpt_packet_generator"
  },
  "review_scope": "definition",
  "requested_outcomes": [
    "APPROVED",
    "REJECTED",
    "REVISE"
  ],
  "review_basis_refs": [
    "generated/packets/pkt-kernel-trust-spec-001/machine/packet.definition.json",
    "generated/packets/pkt-kernel-trust-spec-001/machine/scm.pattern.binding.json",
    "generated/packets/pkt-kernel-trust-spec-001/machine/root.trust.evidence.json",
    "generated/packets/pkt-kernel-trust-spec-001/machine/artifact.manifest.json",
    "control/trust/trust.spec.json",
    "control/trust/trust.spec.md",
    "control/trust/root.signers.json",
    "control/trust/delegations/chatgpt.packet-sidecar.json",
    "control/scm.pattern/authority.manifest.json",
    "manifests/bundles/bundle-closure.manifest.json",
    "pipeline/chatgpt.packet.pipeline.manifest.json",
    "pipeline/chatgpt.execution.policy.json",
    "pipeline/chatgpt.validation.manifest.json",
    "pipeline/chatgpt.gate.policy.json",
    "pipeline/problem_set.schema.json"
  ],
  "kernel_trust": {
    "root_signers_ref": "control/trust/root.signers.json",
    "root_delegation_ref": "control/trust/delegations/chatgpt.packet-sidecar.json",
    "authority_manifest_ref": "control/scm.pattern/authority.manifest.json",
    "bundle_manifest_ref": "manifests/bundles/bundle-closure.manifest.json",
    "packet_trust_evidence_ref": "generated/packets/pkt-kernel-trust-spec-001/machine/root.trust.evidence.json"
  },
  "human_action_required": true,
  "approval_authority": false,
  "artifact_status": "REVIEW_REQUEST_SUBMITTED"
}
